{
  "schema_version": "1.0",
  "work_id": "work_9876543210fedcba",
  "title": "Robust Transformer Models for Optical Flow",
  "authors": [
    "Alice Smith",
    "Bob Jones"
  ],
  "year": 2024,
  "doi": null,
  "arxiv_id": null,
  "document_ids": [
    "doc_a1b2c3d4e5f60718"
  ],
  "merge_status": "unreviewed"
}
